IP;ASN;{CVEs};[Ports];Time;AS_Desc
111.91.18.135;38457;{'CVE-2019-0708': 'Windows RDP RCE (BlueKeep)'};[1024, 3389, 53];2020-07-03 14:22:36;Honesty Net Solution (I) Pvt
112.133.213.132;24186;{'CVE-2019-0708': 'Windows RDP RCE (BlueKeep)'};[443, 500, 3389];2020-07-03 17:54:17;RailTel Corporation Of India Ltd.
115.124.127.160;45815;{'CVE-2016-9963': 'CVE-2016-9963', 'CVE-2019-10149': 'CVE-2019-10149', 'CVE-2019-13917': 'CVE-2019-13917'};[993, 995, 2086, 2087, 5353, 3306, 587, 80, 2083, 21, 443, 53, 2079];2020-07-03 19:01:05;ESDS Software Solution Pvt.
182.71.211.10;9498;{'CVE-2019-0708': 'Windows RDP RCE (BlueKeep)'};[80, 1433, 443, 3389];2020-07-03 11:06:37;Airtel
59.145.161.155;9498;{'CVE-2019-0708': 'Windows RDP RCE (BlueKeep)'};[3389];2020-07-03 11:15:49;Airtel Broadband
