IP;ASN;{CVEs};[Ports];Time;AS_Desc
178.18.196.84;50941;{'CVE-2019-0708': 'Windows RDP RCE (BlueKeep)'};[8880, 8443, 8111, 3306, 587, 110, 143, 80, 53, 2006, 25, 8090, 443, 3389, 8085];2020-07-02 21:38:56;Vargonen Teknoloji ve Bilisim Sanayi Ticaret Anoni
178.18.197.6;43391;{'CVE-2019-10149': 'CVE-2019-10149', 'CVE-2019-13917': 'CVE-2019-13917'};[993, 2082, 995, 2086, 2087, 3306, 587, 143, 80, 465, 2083, 53, 443, 21];2020-07-02 16:49:20;Netdirekt A.S.
185.134.185.108;205725;{'CVE-2020-0796': 'MS SMBv3 RCE (SMBGhost)'};[2000, 445, 3389];2020-07-02 10:37:48;Selcuk Ecza Deposu Ticaret ve Sanayi Anonim Sirket
193.164.5.6;61135;{'CVE-2019-0708': 'Windows RDP RCE (BlueKeep)'};[3389, 445];2020-07-02 02:39:37;Comnet Bilgi Iletisim Teknolojileri Ticaret A.s.
194.1.184.70;210107;{'CVE-2019-0708': 'Windows RDP RCE (BlueKeep)'};[3389];2020-07-02 02:17:07;Plusweb Sunucu Internet Hizmetleri Ticaret Limited
213.128.74.253;42926;{'CVE-2019-10149': 'CVE-2019-10149', 'CVE-2019-13917': 'CVE-2019-13917'};[993, 2082, 2083, 2086, 2087, 587, 110, 143, 80, 465, 995, 21, 2079, 443, 53];2020-07-02 19:39:10;Radore Veri Merkezi Hizmetleri A.S.
213.159.28.3;42807;{'CVE-2019-10149': 'CVE-2019-10149', 'CVE-2019-13917': 'CVE-2019-13917'};[993, 2082, 2083, 2086, 2087, 3306, 587, 110, 143, 80, 465, 995, 53, 22, 443, 21];2020-07-02 04:21:01;Aerotek Bilisim Sanayi ve Ticaret
37.75.10.78;199484;{'CVE-2019-10149': 'CVE-2019-10149', 'CVE-2019-13917': 'CVE-2019-13917'};[993, 2082, 2083, 2086, 2087, 3306, 587, 110, 143, 80, 465, 995, 21, 22, 443, 53];2020-07-02 03:39:32;SAGLAYICI Teknoloji Bilisim Yayincilik Hiz. Ticare
