IP;ASN;{CVEs};[Ports];Time;AS_Desc
178.18.196.11;50941;{'CVE-2019-0708': 'Windows RDP RCE (BlueKeep)'};[80, 8443, 3306, 110, 143, 8880, 53, 8085, 25, 8090, 443, 3389, 21];2020-11-25 22:11:21;Vargonen Teknoloji ve Bilisim Sanayi Ticaret Anoni
178.18.199.122;50941;{'CVE-2019-0708': 'Windows RDP RCE (BlueKeep)'};[9090, 80, 25, 1433, 8090, 443, 3389];2020-11-25 13:31:52;Vargonen Teknoloji ve Bilisim Sanayi Ticaret Anoni
193.164.5.182;unknown;{'CVE-2020-0796': 'MS SMBv3 RCE (SMBGhost)'};[445];2020-11-25 22:00:40;Comnet Bilgi Iletisim Teknolojileri Ticaret A.s.
194.1.192.109;210107;{'CVE-2019-0708': 'Windows RDP RCE (BlueKeep)'};[3389];2020-11-25 13:46:09;Plusweb Sunucu Internet Hizmetleri Ticaret Limited
89.35.52.122;61135;{'CVE-2020-0796': 'MS SMBv3 RCE (SMBGhost)'};[445, 3389];2020-11-25 01:14:29;Comnet Bilgi Iletisim Teknolojileri Ticaret A.s.
