IP;ASN;{CVEs};[Ports];Time;AS_Desc
178.18.196.13;50941;{'CVE-2019-0708': 'Windows RDP RCE (BlueKeep)'};[443, 587, 110, 143, 8880, 53, 25, 8090, 8443, 3389, 21];2020-11-24 14:51:43;Vargonen Teknoloji ve Bilisim Sanayi Ticaret Anoni
178.18.196.82;50941;{'CVE-2019-0708': 'Windows RDP RCE (BlueKeep)'};[80, 3306, 587, 110, 143, 8880, 21, 25, 8090, 3389, 53];2020-11-24 10:00:22;Vargonen Teknoloji ve Bilisim Sanayi Ticaret Anoni
194.1.184.70;210107;{'CVE-2019-0708': 'Windows RDP RCE (BlueKeep)'};[3389];2020-11-24 01:12:24;Plusweb Sunucu Internet Hizmetleri Ticaret Limited
37.75.10.171;199484;{'CVE-2019-0708': 'Windows RDP RCE (BlueKeep)'};[139, 3389, 445];2020-11-24 23:18:39;SAGLAYICI Teknoloji Bilisim Yayincilik Hiz. Ticare
77.92.12.181;43356;{'CVE-2019-0708': 'Windows RDP RCE (BlueKeep)'};[7547];2020-11-24 03:58:31;Comtech Ticaret LTD.
